{
	"$schema": "http://json-schema.org/draft-07/schema#",
	"$id": "https://github.com/lilvapx/personality-tests/blob/main/data/schema/translation.schema.json",
	"title": "Translation",
	"description": "Übersetzungsdatei pro Sprache: item_id → Fragetext + Skalen-Labels. Enthält nur Text, keine Scoring-Logik.",
	"type": "object",
	"required": ["locale", "items", "response_scale"],
	"properties": {
		"locale": {
			"type": "string",
			"pattern": "^[a-z]{2}(-[A-Z]{2})?$",
			"description": "BCP-47 Locale, z.B. 'de', 'en', 'lt'"
		},
		"items": {
			"type": "object",
			"propertyNames": {
				"pattern": "^[a-z0-9-]+$"
			},
			"additionalProperties": {
				"type": "object",
				"required": ["text"],
				"properties": {
					"text": {
						"type": "string",
						"minLength": 1,
						"description": "Fragetext in dieser Sprache"
					}
				},
				"additionalProperties": false
			},
			"description": "Map: item_id → { text }"
		},
		"response_scale": {
			"type": "object",
			"required": ["labels"],
			"properties": {
				"labels": {
					"type": "object",
					"additionalProperties": {
						"type": "string",
						"minLength": 1
					},
					"description": "Skalen-Labels, z.B. { \"1\": \"Stimme gar nicht zu\", \"5\": \"Stimme voll zu\" }"
				}
			},
			"additionalProperties": false
		},
		"labels": {
			"type": "object",
			"description": "Übersetzte Namen der Domains und Facetten für die Auswertung.",
			"properties": {
				"domains": {
					"type": "object",
					"additionalProperties": {
						"type": "string",
						"minLength": 1
					}
				},
				"facets": {
					"type": "object",
					"additionalProperties": {
						"type": "string",
						"minLength": 1
					}
				}
			},
			"required": ["domains", "facets"]
		},
		"translation_status": {
			"type": "string",
			"enum": ["official_ipip", "community_verified", "community_draft", "machine_draft"],
			"description": "Vierstufiger Qualitätsstatus der Übersetzung: official_ipip = offizielle IPIP-Quelle; community_verified = von Muttersprachlern/Experten geprüft; community_draft = eigene/Community-Übersetzung, ungeprüft; machine_draft = maschinelle Übersetzung"
		},
		"back_translation_checked": {
			"type": "boolean",
			"description": "true = Übersetzung wurde per Back-Translation geprüft"
		}
	},
	"additionalProperties": false
}
