{
	"locale": "en",
	"items": {
		"ipip-neo-300-001": {
			"text": "Worry about things."
		},
		"ipip-neo-300-002": {
			"text": "Fear for the worst."
		},
		"ipip-neo-300-003": {
			"text": "Am afraid of many things."
		},
		"ipip-neo-300-004": {
			"text": "Get stressed out easily."
		},
		"ipip-neo-300-005": {
			"text": "Get caught up in my problems."
		},
		"ipip-neo-300-006": {
			"text": "Am not easily bothered by things."
		},
		"ipip-neo-300-007": {
			"text": "Am relaxed most of the time."
		},
		"ipip-neo-300-008": {
			"text": "Am not easily disturbed by events."
		},
		"ipip-neo-300-009": {
			"text": "Don't worry about things that have already happened."
		},
		"ipip-neo-300-010": {
			"text": "Adapt easily to new situations."
		},
		"ipip-neo-300-011": {
			"text": "Get angry easily."
		},
		"ipip-neo-300-012": {
			"text": "Get irritated easily."
		},
		"ipip-neo-300-013": {
			"text": "Get upset easily."
		},
		"ipip-neo-300-014": {
			"text": "Am often in a bad mood."
		},
		"ipip-neo-300-015": {
			"text": "Lose my temper."
		},
		"ipip-neo-300-016": {
			"text": "Rarely get irritated."
		},
		"ipip-neo-300-017": {
			"text": "Seldom get mad."
		},
		"ipip-neo-300-018": {
			"text": "Am not easily annoyed."
		},
		"ipip-neo-300-019": {
			"text": "Keep my cool."
		},
		"ipip-neo-300-020": {
			"text": "Rarely complain."
		},
		"ipip-neo-300-021": {
			"text": "Often feel blue."
		},
		"ipip-neo-300-022": {
			"text": "Dislike myself."
		},
		"ipip-neo-300-023": {
			"text": "Am often down in the dumps."
		},
		"ipip-neo-300-024": {
			"text": "Have a low opinion of myself."
		},
		"ipip-neo-300-025": {
			"text": "Have frequent mood swings."
		},
		"ipip-neo-300-026": {
			"text": "Feel desperate."
		},
		"ipip-neo-300-027": {
			"text": "Feel that my life lacks direction."
		},
		"ipip-neo-300-028": {
			"text": "Seldom feel blue."
		},
		"ipip-neo-300-029": {
			"text": "Feel comfortable with myself."
		},
		"ipip-neo-300-030": {
			"text": "Am very pleased with myself."
		},
		"ipip-neo-300-031": {
			"text": "Am easily intimidated."
		},
		"ipip-neo-300-032": {
			"text": "Am afraid that I will do the wrong thing."
		},
		"ipip-neo-300-033": {
			"text": "Find it difficult to approach others."
		},
		"ipip-neo-300-034": {
			"text": "Am afraid to draw attention to myself."
		},
		"ipip-neo-300-035": {
			"text": "Only feel comfortable with friends."
		},
		"ipip-neo-300-036": {
			"text": "Stumble over my words."
		},
		"ipip-neo-300-037": {
			"text": "Am not embarrassed easily."
		},
		"ipip-neo-300-038": {
			"text": "Am comfortable in unfamiliar situations."
		},
		"ipip-neo-300-039": {
			"text": "Am not bothered by difficult social situations."
		},
		"ipip-neo-300-040": {
			"text": "Am able to stand up for myself."
		},
		"ipip-neo-300-041": {
			"text": "Often eat too much."
		},
		"ipip-neo-300-042": {
			"text": "Don't know why I do some of the things I do."
		},
		"ipip-neo-300-043": {
			"text": "Do things I later regret."
		},
		"ipip-neo-300-044": {
			"text": "Go on binges."
		},
		"ipip-neo-300-045": {
			"text": "Love to eat."
		},
		"ipip-neo-300-046": {
			"text": "Rarely overindulge."
		},
		"ipip-neo-300-047": {
			"text": "Easily resist temptations."
		},
		"ipip-neo-300-048": {
			"text": "Am able to control my cravings."
		},
		"ipip-neo-300-049": {
			"text": "Never spend more than I can afford."
		},
		"ipip-neo-300-050": {
			"text": "Never splurge."
		},
		"ipip-neo-300-051": {
			"text": "Panic easily."
		},
		"ipip-neo-300-052": {
			"text": "Become overwhelmed by events."
		},
		"ipip-neo-300-053": {
			"text": "Feel that I'm unable to deal with things."
		},
		"ipip-neo-300-054": {
			"text": "Can't make up my mind."
		},
		"ipip-neo-300-055": {
			"text": "Get overwhelmed by emotions."
		},
		"ipip-neo-300-056": {
			"text": "Remain calm under pressure."
		},
		"ipip-neo-300-057": {
			"text": "Can handle complex problems."
		},
		"ipip-neo-300-058": {
			"text": "Know how to cope."
		},
		"ipip-neo-300-059": {
			"text": "Readily overcome setbacks."
		},
		"ipip-neo-300-060": {
			"text": "Am calm even in tense situations."
		},
		"ipip-neo-300-061": {
			"text": "Make friends easily."
		},
		"ipip-neo-300-062": {
			"text": "Warm up quickly to others."
		},
		"ipip-neo-300-063": {
			"text": "Feel comfortable around people."
		},
		"ipip-neo-300-064": {
			"text": "Act comfortably with others."
		},
		"ipip-neo-300-065": {
			"text": "Cheer people up."
		},
		"ipip-neo-300-066": {
			"text": "Am hard to get to know."
		},
		"ipip-neo-300-067": {
			"text": "Often feel uncomfortable around others."
		},
		"ipip-neo-300-068": {
			"text": "Avoid contacts with others."
		},
		"ipip-neo-300-069": {
			"text": "Am not really interested in others."
		},
		"ipip-neo-300-070": {
			"text": "Keep others at a distance."
		},
		"ipip-neo-300-071": {
			"text": "Love large parties."
		},
		"ipip-neo-300-072": {
			"text": "Talk to a lot of different people at parties."
		},
		"ipip-neo-300-073": {
			"text": "Enjoy being part of a group."
		},
		"ipip-neo-300-074": {
			"text": "Involve others in what I am doing."
		},
		"ipip-neo-300-075": {
			"text": "Love surprise parties."
		},
		"ipip-neo-300-076": {
			"text": "Prefer to be alone."
		},
		"ipip-neo-300-077": {
			"text": "Want to be left alone."
		},
		"ipip-neo-300-078": {
			"text": "Don't like crowded events."
		},
		"ipip-neo-300-079": {
			"text": "Avoid crowds."
		},
		"ipip-neo-300-080": {
			"text": "Seek quiet."
		},
		"ipip-neo-300-081": {
			"text": "Take charge."
		},
		"ipip-neo-300-082": {
			"text": "Try to lead others."
		},
		"ipip-neo-300-083": {
			"text": "Can talk others into doing things."
		},
		"ipip-neo-300-084": {
			"text": "Seek to influence others."
		},
		"ipip-neo-300-085": {
			"text": "Take control of things."
		},
		"ipip-neo-300-086": {
			"text": "Wait for others to lead the way."
		},
		"ipip-neo-300-087": {
			"text": "Keep in the background."
		},
		"ipip-neo-300-088": {
			"text": "Have little to say."
		},
		"ipip-neo-300-089": {
			"text": "Don't like to draw attention to myself."
		},
		"ipip-neo-300-090": {
			"text": "Hold back my opinions."
		},
		"ipip-neo-300-091": {
			"text": "Am always busy."
		},
		"ipip-neo-300-092": {
			"text": "Am always on the go."
		},
		"ipip-neo-300-093": {
			"text": "Do a lot in my spare time."
		},
		"ipip-neo-300-094": {
			"text": "Can manage many things at the same time."
		},
		"ipip-neo-300-095": {
			"text": "React quickly."
		},
		"ipip-neo-300-096": {
			"text": "Like to take it easy."
		},
		"ipip-neo-300-097": {
			"text": "Like to take my time."
		},
		"ipip-neo-300-098": {
			"text": "Like a leisurely lifestyle."
		},
		"ipip-neo-300-099": {
			"text": "Let things proceed at their own pace."
		},
		"ipip-neo-300-100": {
			"text": "React slowly."
		},
		"ipip-neo-300-101": {
			"text": "Love excitement."
		},
		"ipip-neo-300-102": {
			"text": "Seek adventure."
		},
		"ipip-neo-300-103": {
			"text": "Love action."
		},
		"ipip-neo-300-104": {
			"text": "Enjoy being part of a loud crowd."
		},
		"ipip-neo-300-105": {
			"text": "Enjoy being reckless."
		},
		"ipip-neo-300-106": {
			"text": "Act wild and crazy."
		},
		"ipip-neo-300-107": {
			"text": "Willing to try anything once."
		},
		"ipip-neo-300-108": {
			"text": "Seek danger."
		},
		"ipip-neo-300-109": {
			"text": "Would never go hang gliding or bungee jumping."
		},
		"ipip-neo-300-110": {
			"text": "Dislike loud music."
		},
		"ipip-neo-300-111": {
			"text": "Radiate joy."
		},
		"ipip-neo-300-112": {
			"text": "Have a lot of fun."
		},
		"ipip-neo-300-113": {
			"text": "Express childlike joy."
		},
		"ipip-neo-300-114": {
			"text": "Laugh my way through life."
		},
		"ipip-neo-300-115": {
			"text": "Love life."
		},
		"ipip-neo-300-116": {
			"text": "Look at the bright side of life."
		},
		"ipip-neo-300-117": {
			"text": "Laugh aloud."
		},
		"ipip-neo-300-118": {
			"text": "Amuse my friends."
		},
		"ipip-neo-300-119": {
			"text": "Am not easily amused."
		},
		"ipip-neo-300-120": {
			"text": "Seldom joke around."
		},
		"ipip-neo-300-121": {
			"text": "Have a vivid imagination."
		},
		"ipip-neo-300-122": {
			"text": "Enjoy wild flights of fantasy."
		},
		"ipip-neo-300-123": {
			"text": "Love to daydream."
		},
		"ipip-neo-300-124": {
			"text": "Like to get lost in thought."
		},
		"ipip-neo-300-125": {
			"text": "Indulge in my fantasies."
		},
		"ipip-neo-300-126": {
			"text": "Spend time reflecting on things."
		},
		"ipip-neo-300-127": {
			"text": "Seldom daydream."
		},
		"ipip-neo-300-128": {
			"text": "Do not have a good imagination."
		},
		"ipip-neo-300-129": {
			"text": "Seldom get lost in thought."
		},
		"ipip-neo-300-130": {
			"text": "Have difficulty imagining things."
		},
		"ipip-neo-300-131": {
			"text": "Believe in the importance of art."
		},
		"ipip-neo-300-132": {
			"text": "Like music."
		},
		"ipip-neo-300-133": {
			"text": "See beauty in things that others might not notice."
		},
		"ipip-neo-300-134": {
			"text": "Love flowers."
		},
		"ipip-neo-300-135": {
			"text": "Enjoy the beauty of nature."
		},
		"ipip-neo-300-136": {
			"text": "Do not like art."
		},
		"ipip-neo-300-137": {
			"text": "Do not like poetry."
		},
		"ipip-neo-300-138": {
			"text": "Do not enjoy going to art museums."
		},
		"ipip-neo-300-139": {
			"text": "Do not like concerts."
		},
		"ipip-neo-300-140": {
			"text": "Do not enjoy watching dance performances."
		},
		"ipip-neo-300-141": {
			"text": "Experience my emotions intensely."
		},
		"ipip-neo-300-142": {
			"text": "Feel others' emotions."
		},
		"ipip-neo-300-143": {
			"text": "Am passionate about causes."
		},
		"ipip-neo-300-144": {
			"text": "Enjoy examining myself and my life."
		},
		"ipip-neo-300-145": {
			"text": "Try to understand myself."
		},
		"ipip-neo-300-146": {
			"text": "Seldom get emotional."
		},
		"ipip-neo-300-147": {